{
  "$schema": "https://erdesigns.eu/schema/kwp-identifiers.json",
  "schema_version": 1,
  "description": "KWP2000 (ISO 14230-3) common identifier catalogue. Covers the standard ECU-identification block read via Service 0x1A (ReadECUIdentification) and the well-known LocalIdentifiers / CommonIdentifiers exposed by Service 0x21 / 0x22. OEM-specific identifiers overlay this seed via TOBDOEMCatalog.",
  "kind": "kwp-identifier",
  "source": "ISO 14230-3:1999 §6.7",
  "ecu_identification": [
    { "id": "0x80", "name": "ECU Configuration",
                    "service": "0x1A",
                    "length": 16,
                    "notes": "Bit-packed configuration record." },
    { "id": "0x86", "name": "Diagnostic Data Identification Table",
                    "service": "0x1A",
                    "length": "variable" },
    { "id": "0x87", "name": "ECU Manufacturing Data",
                    "service": "0x1A",
                    "length": 16 },
    { "id": "0x88", "name": "VIN — Vehicle Identification Number",
                    "service": "0x1A",
                    "length": 17,
                    "notes": "ISO 3779-format ASCII VIN." },
    { "id": "0x89", "name": "Diagnostic Variant Code",
                    "service": "0x1A",
                    "length": 2 },
    { "id": "0x90", "name": "VIN (Original)",
                    "service": "0x1A",
                    "length": 17 },
    { "id": "0x9A", "name": "ECU Identification — Generic",
                    "service": "0x1A",
                    "length": "variable",
                    "notes": "Returns ECU part number + version banner." },
    { "id": "0x9B", "name": "ECU Identification — Manufacturer",
                    "service": "0x1A",
                    "length": "variable" }
  ],
  "common_identifiers": [
    { "id": "0xF180", "name": "Boot Software Identification",
                       "service": "0x22" },
    { "id": "0xF181", "name": "Application Software Identification",
                       "service": "0x22" },
    { "id": "0xF182", "name": "Application Data Identification",
                       "service": "0x22" },
    { "id": "0xF183", "name": "Boot Software Fingerprint",
                       "service": "0x22" },
    { "id": "0xF184", "name": "Application Software Fingerprint",
                       "service": "0x22" },
    { "id": "0xF186", "name": "Active Diagnostic Session",
                       "service": "0x22" },
    { "id": "0xF187", "name": "ECU Spare Part Number",
                       "service": "0x22" },
    { "id": "0xF188", "name": "ECU Software Number",
                       "service": "0x22" },
    { "id": "0xF189", "name": "ECU Software Version",
                       "service": "0x22" },
    { "id": "0xF18A", "name": "System Supplier",
                       "service": "0x22" },
    { "id": "0xF18B", "name": "ECU Manufacturing Date",
                       "service": "0x22" },
    { "id": "0xF18C", "name": "ECU Serial Number",
                       "service": "0x22" },
    { "id": "0xF190", "name": "Vehicle Identification Number (VIN)",
                       "service": "0x22" },
    { "id": "0xF195", "name": "System Diagnostic Specification Version",
                       "service": "0x22" },
    { "id": "0xF197", "name": "System Name / Engine Type",
                       "service": "0x22" },
    { "id": "0xF198", "name": "Repair Shop Code",
                       "service": "0x22" },
    { "id": "0xF199", "name": "Programming Date",
                       "service": "0x22" }
  ]
}
